[
  {"rule_id":"MV0001","category":"MOVEMENT","phase":"attacking_organisation","trigger":"ball_in_wide_zone_own_side","condition":"striker_marked_tightly_centrally","actor":"striker","action":"check_away_then_spin_in_behind","target":"Z28","purpose":"create separation from a tight marker via double movement","expected_result":"striker receives in behind with a half-yard of separation","risk":"mistimed check gives the marker time to recover before the spin","counter":"defender delays commitment to the check, waiting for the spin","confidence":"medium-high","source_class":"C"},
  {"rule_id":"MV0002","category":"MOVEMENT","phase":"attacking_organisation","trigger":"winger_holds_wide_position","condition":"opposing_fullback_engaged_by_width","actor":"inverted_winger","action":"diagonal_run_into_half_space","target":"Z22","purpose":"exploit the half-space left open once the fullback is fixed wide","expected_result":"receives between lines facing goal","risk":"if the fullback recovers centrally in time, the run is easily tracked","counter":"covering CB shifts across to shadow the half-space run","confidence":"medium","source_class":"C"},
  {"rule_id":"MV0003","category":"MOVEMENT","phase":"attacking_organisation","trigger":"false_nine_drops_deep","condition":"marking_cb_follows","actor":"winger_or_8","action":"blind_side_run_in_behind","target":"Z28","purpose":"exploit the space vacated by the CB who followed the false nine","expected_result":"1v1 run in behind against the covering CB alone","risk":"offside if timing misjudged","counter":"CB declines to follow, holding the line instead","confidence":"medium-high","source_class":"C"},
  {"rule_id":"PS0001","category":"PASSING","phase":"attacking_organisation","trigger":"double_pivot_press_committed","condition":"weak_side_half_space_open","actor":"pivot_player","action":"third_man_release","target":"Z17","purpose":"bypass the committed press via a pre-planned third-man pattern","expected_result":"line-broken possession beyond the first press line","risk":"requires precise timing between all three players involved","counter":"opponent's covering midfielder anticipates and intercepts the third-man pass","confidence":"medium","source_class":"C"},
  {"rule_id":"PS0002","category":"PASSING","phase":"attacking_organisation","trigger":"cb_in_possession_under_no_pressure","condition":"switch_lane_open","actor":"cb","action":"long_diagonal_switch","target":"Z25","purpose":"exploit a weak-side numerical advantage created by opponent ball-side shift","expected_result":"receiver isolated 1v1 in space","risk":"technical execution risk on a long diagonal ball","counter":"weak-side fullback stays slightly narrower than usual to cut the passing lane","confidence":"medium","source_class":"C"},
  {"rule_id":"PR0001","category":"PRESSING","phase":"defensive_organisation","trigger":"back_pass_to_goalkeeper","condition":"gk_weak_foot_or_low_composure","actor":"striker","action":"curved_press_cutting_return_pass","target":"Z3","purpose":"force a rushed long ball or turnover from the goalkeeper","expected_result":"regain possession high or force a long, low-percentage clearance","risk":"foul risk if mistimed near the box","counter":"gk plays first-time to a supporting CB before the press arrives","confidence":"medium-high","source_class":"C"},
  {"rule_id":"PR0002","category":"PRESSING","phase":"defensive_organisation","trigger":"midfielder_receives_side_on","condition":"cover_shadow_available","actor":"nearest_presser","action":"press_from_cover_shadow_angle","target":"Z13","purpose":"force the ball backward or into a covered lane rather than forward","expected_result":"possession recycled backward, tempo of the attack broken","risk":"if the presser's angle is wrong, a forward lane is left open instead","counter":"receiver uses a first-time lay-off to bypass the press entirely","confidence":"medium","source_class":"C"},
  {"rule_id":"DF0001","category":"DEFENDING","phase":"defensive_organisation","trigger":"opponent_winger_isolated_1v1","condition":"no_covering_support_arrived","actor":"fullback","action":"jockey_show_outside","target":"Z20","purpose":"delay the attacker and force a low-value wide cross rather than a central cutback","expected_result":"cross delivered from a deep/wide angle with reduced danger","risk":"a technically excellent dribbler beats the show with a body feint","counter":"attacker uses change of pace rather than change of direction to beat the jockey","confidence":"medium-high","source_class":"C"},
  {"rule_id":"DF0002","category":"DEFENDING","phase":"defensive_transition","trigger":"possession_lost_in_middle_third","condition":"three_players_within_counterpress_range","actor":"nearest_three_players","action":"immediate_counterpress_swarm","target":"ball_carrier","purpose":"win the ball back before the opponent's transition attack organizes","expected_result":"regain in a dangerous zone or force a rushed backward pass","risk":"if the counterpress fails, the team is stretched and vulnerable to a fast break","counter":"opponent's carrier plays an immediate first-time release before the swarm arrives","confidence":"medium","source_class":"B"},
  {"rule_id":"AT0001","category":"ATTACKING","phase":"attacking_organisation","trigger":"low_block_fully_set","condition":"no_penetrative_passing_lane_available","actor":"striker","action":"direct_run_in_behind_on_first_gap","target":"Z28","purpose":"force the low block to defend deeper and honestly rather than statically","expected_result":"back line drops, opening cutback zones for teammates","risk":"isolated run with no immediate end product if the pass doesn't arrive","counter":"back line holds its shape and accepts the offside risk rather than dropping","confidence":"medium","source_class":"C"},
  {"rule_id":"TR0001","category":"TRANSITION","phase":"offensive_transition","trigger":"ball_won_in_defensive_third","condition":"clear_forward_passing_lane_within_2_seconds","actor":"ball_winner","action":"immediate_vertical_release","target":"advanced_forward_runner","purpose":"exploit the opponent's disorganized defensive transition shape","expected_result":"fast break with a numerical or positional advantage","risk":"a misplaced pass under transition speed gives the ball straight back","counter":"opponent's rest defence shape (core KB Section 16) intercepts the release","confidence":"medium","source_class":"B"},
  {"rule_id":"FM0001","category":"FORMATION","phase":"any","trigger":"opponent_switches_to_back_five","condition":"team_currently_in_back_four_two_strikers","actor":"coaching_staff","action":"shift_wide_forwards_to_directly_occupy_wing_back_zones","target":"Z20_Z25","purpose":"prevent the extra defender from simply absorbing a spare man for free","expected_result":"restores a direct 1v1 matchup in wide areas rather than conceding a passive numerical mismatch","risk":"stretches the team's own central presence thinner","counter":"opponent's back five simply sits deeper, absorbing the direct occupation without being troubled","confidence":"medium","source_class":"C"},
  {"rule_id":"SP0001","category":"SPACE","phase":"any","trigger":"opponent_shifts_six_players_ball_side","condition":"weak_side_zone_occupied_by_single_defender","actor":"tactical_engine","action":"flag_weak_side_overload_opportunity","target":"weak_side_half_space","purpose":"surface a positional-superiority opportunity to the decision engine","expected_result":"a switch-of-play recommendation is generated (see 02_EXPLAINABLE_AI_AND_UNCERTAINTY.md worked example)","risk":"opportunity window may close before the switch can be executed","counter":"opponent's weak-side defender delays their own recovery run to bait an early switch","confidence":"medium-high","source_class":"F"},
  {"rule_id":"PL0001","category":"PLAYER","phase":"any","trigger":"player_forced_onto_weak_foot_repeatedly","condition":"weak_foot_rating_below_average","actor":"tactical_engine","action":"flag_technical_mismatch_for_substitution_or_instruction_review","target":"affected_player","purpose":"surface a recurring individual technical vulnerability being exploited","expected_result":"a coaching adjustment (core KB Part BM pattern) is triggered","risk":"over-correcting can remove a player's primary strength (their stronger side) from the game entirely if misapplied","counter":"n/a — this is an internal flag, not an on-pitch action","confidence":"medium","source_class":"F"},
  {"rule_id":"GS0001","category":"GAME_STATE","phase":"any","trigger":"team_leading_by_one_goal_after_75th_minute","condition":"opponent_committing_numbers_forward","actor":"coaching_staff","action":"shift_to_deeper_defensive_line_with_compact_low_block","target":"own_defensive_third","purpose":"reduce space in behind against a chasing opponent's committed attack (core KB Part BD/§24)","expected_result":"lower quality/quantity of chances conceded, at the cost of territorial concession","risk":"sustained pressure can eventually break down even a well-organized low block","counter":"opponent introduces a target-man substitute to increase direct aerial threat against the deeper line","confidence":"medium-high","source_class":"B"},
  {"rule_id":"STP0001","category":"SET_PIECE","phase":"set_piece","trigger":"corner_awarded","condition":"opponent_uses_pure_man_marking","actor":"attacking_team","action":"run_screening_block_routine","target":"primary_aerial_threats_marker","purpose":"exploit man-marking's specific vulnerability to legal screening (core KB Section 53.1-53.2)","expected_result":"primary aerial target receives a delivery with a reduced/delayed marker","risk":"mistimed block risks an obstruction/offence call","counter":"defending team switches to a hybrid marking scheme (core KB Section 53.2) specifically to neutralize blocking routines","confidence":"medium","source_class":"C"},